{
  "schema_version": 1,
  "place_id": "CO-05-medellin",
  "department_id": "CO-05",
  "state": "researching",
  "owner": "Lugar 3",
  "reviewer": null,
  "branch": "lugar/CO/antioquia/medellin",
  "pr_url": null,
  "base_commit": "7878eab",
  "blockers": [
    "Asignar responsable y auditar fuentes, permisos y estado real"
  ],
  "next_action": "Investigar destino completo en rama independiente; entrega privada, revisión humana pendiente.",
  "gates": {
    "identidad": {
      "passed": false,
      "evidence": [],
      "reviewer": null,
      "checked_at": null
    },
    "fuentes": {
      "passed": false,
      "evidence": [],
      "reviewer": null,
      "checked_at": null
    },
    "texto": {
      "passed": false,
      "evidence": [],
      "reviewer": null,
      "checked_at": null
    },
    "fotos": {
      "passed": false,
      "evidence": [],
      "reviewer": null,
      "checked_at": null
    },
    "idiomas": {
      "passed": false,
      "evidence": [],
      "reviewer": null,
      "checked_at": null
    },
    "directorio": {
      "passed": false,
      "evidence": [],
      "reviewer": null,
      "checked_at": null
    },
    "tecnica": {
      "passed": false,
      "evidence": [],
      "reviewer": null,
      "checked_at": null
    },
    "privacidad": {
      "passed": false,
      "evidence": [],
      "reviewer": null,
      "checked_at": null
    },
    "revision": {
      "passed": false,
      "evidence": [],
      "reviewer": null,
      "checked_at": null
    }
  },
  "approval": null,
  "publication": null,
  "worker_deliveries": []
}
